objectid,filename,title,creator,date,description,subject,location,format original,format,type,identifier,language,collection,linktocollection,rights,rightsstatement
nimitz1,https://tyvictoria.github.io/Nimitz-Images/nimitz1.jpg,Fleet Admiral Chester W. Nimitz and Mary Nimitz at Christening of U.S.S. Buck,,1945-03-11,Photograph of Fleet Admiral Chester W. Nimitz and Mary Nimitz at Christening of the U.S.S. Buck,"United States. Navy; Nimitz, Chester W.; Nimitz, Mary; U.S.S. Buck; Ships",United States - California - San Francisco County - San Francisco,Black and White Photograph,image/jpeg,Image;StillImage,2005_661_259q,eng,Nimitz Family Photograph Collection,https://digitalarchive.pacificwarmuseum.org/digital/collection/p16769coll6,Commercial use is prohibited without permission from the National Museum of the Pacific War.,https://creativecommons.org/licenses/
nimitz2,https://tyvictoria.github.io/Nimitz-Images/nimitz2.jpg,Christening of the U.S.S. Buck,,1945-03-11,"Photograph of Archbishop Mitty, Fleet Admiral Chester W. Nimitz, and Mary Nimitz at the Christening of the U.S.S. Buck.","United States. Navy; Nimitz, Chester W.; Nimitz, Mary; Mitty, John Joseph; U.S.S. Buck; Ships",United States - California - San Francisco County - San Francisco,Black and White Photograph,image/jpeg,Image;StillImage,2005.661.259n,eng,Nimitz Family Photograph Collection,https://digitalarchive.pacificwarmuseum.org/digital/collection/p16769coll7,Commercial use is prohibited without permission from the National Museum of the Pacific War.,https://creativecommons.org/licenses/
nimitz3,https://tyvictoria.github.io/Nimitz-Images/nimitz3.jpg,Catherine Freeman Nimitz at U.S.S. Sargo Christening,,1938-06-06,Photograph of Catherine Freeman Nimitz at christening of U.S.S. Sargo.,"Nimitz, Catherine Freeman; U.S.S. Sargo; Submarines",United States - Connecticut - New London County - Groton,Black and White Photograph,image/jpeg,Image;StillImage,2005.661.259s,eng,Nimitz Family Photograph Collection,https://digitalarchive.pacificwarmuseum.org/digital/collection/p16769coll8,Commercial use is prohibited without permission from the National Museum of the Pacific War.,https://creativecommons.org/licenses/
nimitz4,https://tyvictoria.github.io/Nimitz-Images/nimitz4.jpg,"Fleet Admiral Chester W. Nimitz, Catherine Nimitz, and Mary Nimitz",,1942-12-09,"Photograph of Fleet Admiral Chester W. Nimitz, Catherine Nimitz, and Mary Nimitz at Naval Air Station, Alameda, California.","United States. Navy; Nimitz, Chester W.; Nimitz, Mary; Nimitz, Catherine Freeman; Naval Air Station Alameda",United States - California -  Alameda County - Alameda,Black and White Photograph,image/jpeg,Image;StillImage,2005.661.259x,eng,Nimitz Family Photograph Collection,https://digitalarchive.pacificwarmuseum.org/digital/collection/p16769coll9,Commercial use is prohibited without permission from the National Museum of the Pacific War.,https://creativecommons.org/licenses/
nimitz5,https://tyvictoria.github.io/Nimitz-Images/nimitz5.jpg,Chester W. Nimitz Signs the Japanese Instrument of Surrender,,1945-09-02,Photograph of Fleet Admiral Chester W. Nimitz signing the Japanese instrument of surrender.,"United States. Navy; Nimitz, Chester W.; U.S.S. Missouri; Tokyo Bay; Surrender; WW2; Ships",Japan - Kanto Region - Tokyo Bay,Black and White Photograph,image/jpeg,Image;StillImage,2017.092.008d-g,eng,Nimitz Family Photograph Collection,https://digitalarchive.pacificwarmuseum.org/digital/collection/p16769coll10,Commercial use is prohibited without permission from the National Museum of the Pacific War.,https://creativecommons.org/licenses/
nimitz6,https://tyvictoria.github.io/Nimitz-Images/nimitz6.jpg,Chester W. Nimitz Sits at Desk,,1965-02-24,Photograph of Chester W. Nimitz sitting at a desk for 80th birthday anniversary.,"United States. Navy; Nimitz, Chester W.; Birthdays",United States - California - San Francisco County - San Francisco,Black and White Photograph,image/jpeg,Image;StillImage,2017.092.008d-kk,eng,Nimitz Family Photograph Collection,https://digitalarchive.pacificwarmuseum.org/digital/collection/p16769coll11,Commercial use is prohibited without permission from the National Museum of the Pacific War.,https://creativecommons.org/licenses/
nimitz7,https://tyvictoria.github.io/Nimitz-Images/nimitz7.jpg,Admiral Chester W. Nimitz and Captain P. V. Mercer in an Office,,1943-11-22,"Photograph of Admiral Chester W. Nimitz in his office, with his dog, Makalapa, laying under his desk during a press conference. Captain P. V. Mercer, Admiral Nimitz's Aide and Assistant Chief of Staff is on right.","United States. Navy; Nimitz, Chester W.; Mercer, P. V.; Makalapa; Dogs; WW2",United States - Hawaii - Honolulu County - Oahu Island,Black and White Photograph,image/jpeg,Image;StillImage,2017.092.008d-nn,eng,Nimitz Family Photograph Collection,https://digitalarchive.pacificwarmuseum.org/digital/collection/p16769coll12,Commercial use is prohibited without permission from the National Museum of the Pacific War.,https://creativecommons.org/licenses/
nimitz8,https://tyvictoria.github.io/Nimitz-Images/nimitz8.jpg,Fleet Admiral Chester W. Nimitz Salutes on Stage,,1945-10-05,Photograph of Fleet Admiral Chester W. Nimitz saluting on stage in Washington D.C..,"United States. Navy; Nimitz, Chester W.",United States - Washington D.C.,Black and White Photograph,image/jpeg,Image;StillImage,	2017.092.008d-oo,eng,Nimitz Family Photograph Collection,https://digitalarchive.pacificwarmuseum.org/digital/collection/p16769coll13,Commercial use is prohibited without permission from the National Museum of the Pacific War.,https://creativecommons.org/licenses/
nimitz9,https://tyvictoria.github.io/Nimitz-Images/nimitz9.jpg,"Ralph H. Mitchell, Holland M. Smith, Chester W. Nimitz, Aubrey W. Fitch, and William F. Halsey",,1943-06-16,"Photograph of Major General Mitchell, Major General Smith, Admiral Chester W. Nimitz, Vice Admiral Fitch, and Admiral Halsey.","Fitch, Aubrey W.; Halsey, William F., Jr.; Smith, Holland M.;Mitchell, Ralph H.; Nimitz, Chester W.; WW2",Vanuatu - Espiritu Santo Island,Black and White Photograph,image/jpeg,Image;StillImage,2017.092.008d-p,eng,Nimitz Family Photograph Collection,https://digitalarchive.pacificwarmuseum.org/digital/collection/p16769coll14,Commercial use is prohibited without permission from the National Museum of the Pacific War.,https://creativecommons.org/licenses/
nimitz10,https://tyvictoria.github.io/Nimitz-Images/nimitz10.jpg,"Douglas MacArthur, Franklin D. Roosevelt, and Chester W. Nimitz Onboard the U.S.S. Baltimore, #2",Official U.S. Navy Photograph,1944-07-26,"Photograph of General Douglas MacArthur, President Franklin D. Roosevelt, and Admiral Chester W. Nimitz sitting side by side on the U.S.S. Baltimore.","United States. Navy; United States. Air Force; Roosevelt, Franklin D.; Macarthur, Douglas; Nimitz, Chester W.; U.S.S. Baltimore; Presidents; Pacific Fleet; WW2; Ships",United States,Black and White Photograph,image/jpeg,Image;StillImage,2017.092.008d-tt,eng,Nimitz Family Photograph Collection,https://digitalarchive.pacificwarmuseum.org/digital/collection/p16769coll15,Commercial use is prohibited without permission from the National Museum of the Pacific War.,https://creativecommons.org/licenses/
nimitz11,https://tyvictoria.github.io/Nimitz-Images/nimitz11.jpg,"Douglas MacArthur, Franklin D. Roosevelt, and Chester W. Nimitz Onboard the U.S.S. Baltimore",Official U.S. Navy Photograph,1944-07-26,"Photograph of General Douglas MacArthur, President Franklin D. Roosevelt, and Admiral Chester W. Nimitz sitting side by side on the U.S.S. Baltimore.","United States. Navy; United States. Air Force; Roosevelt, Franklin D.; Macarthur, Douglas; Nimitz, Chester W.; U.S.S. Baltimore; Presidents; Pacific Fleet; WW2; Ships",United States,Black and White Photograph,image/jpeg,Image;StillImage,2017.092.008d-uu,eng,Nimitz Family Photograph Collection,https://digitalarchive.pacificwarmuseum.org/digital/collection/p16769coll16,Commercial use is prohibited without permission from the National Museum of the Pacific War.,https://creativecommons.org/licenses/
nimitz12,https://tyvictoria.github.io/Nimitz-Images/nimitz12.jpg,Admiral Raymond A. Spruance and Fleet Admiral Chester W. Nimitz at Command Change Ceremony,Official U.S. Navy Photograph,1945-11-24,"Photograph of Admiral Raymond A. Spruance, Fleet Admiral Chester W. Nimitz, Vice Admiral J. H. Newton, U.S.N., Rear Admiral Dewitt C. Ramsey U.S.N., Cdr. James Loo, U.S.N. and Lieut. Sam L. Bernard during change of command on board U.S.S. Menhaden, Submarine Base, Pearl Harbor.","United States. Navy; Nimitz, Chester W.; Spruance, Raymond A.; Newton, J. H.; Ramsey, Dewitt C.; Loo, James; Bernard, Sam L.; U.S.S. Menhaden; Submarine Base; Pearl Harbor; Change of Command; Ceremonies; Ships",United States - Hawaii - Honolulu County - Oahu Island,Black and White Photograph,image/jpeg,Image;StillImage,2017.092.008e-b,eng,Nimitz Family Photograph Collection,https://digitalarchive.pacificwarmuseum.org/digital/collection/p16769coll17,Commercial use is prohibited without permission from the National Museum of the Pacific War.,https://creativecommons.org/licenses/
nimitz13,https://tyvictoria.github.io/Nimitz-Images/nimitz13.jpg,Fleet Admiral Chester W. Nimitz Waves from Horse Drawn Carriage,,1945-10-13,"Photograph of Fleet Admiral Chester W. Nimitz waving from a carriage drawn by two horses as he makes his way into Kerrville, Texas for a victory celebration.","United States. Navy; Nimitz, Chester W.; Nimitz, Catherine Freeman; Parades; Govenors; Stevenson, Coke ",United States - Texas - Kerr County - Kerrville,Black and White Photograph,image/jpeg,Image;StillImage,2017.092.008e-j,eng,Nimitz Family Photograph Collection,https://digitalarchive.pacificwarmuseum.org/digital/collection/p16769coll18,Commercial use is prohibited without permission from the National Museum of the Pacific War.,https://creativecommons.org/licenses/
nimitz14,https://tyvictoria.github.io/Nimitz-Images/nimitz14.jpg,Chester W. Nimitz in Texas Regalia,,1946-02-14,"Photograph of Chester W. Nimitz standing behind a table and microphone dressed in Texas regalia. Handwritten by Nimitz on front: ""Mary 14 Feb 1946 To my Valentine, Your Dad"". ","United States. Navy; Nimitz, Chester W.; Valentines Day; American Flags; Texas",United States - Washington D.C.,Black and White Photograph,image/jpeg,Image;StillImage,2017.092.008e,eng,Nimitz Family Photograph Collection,https://digitalarchive.pacificwarmuseum.org/digital/collection/p16769coll19,Commercial use is prohibited without permission from the National Museum of the Pacific War.,https://creativecommons.org/licenses/
nimitz15,https://tyvictoria.github.io/Nimitz-Images/nimitz15.jpg,"Chester W. Nimitz and Catherine Freeman Nimitz, #2",,1919-06-22,Photograph of Chester W. Nimitz and Catherine Freeman Nimitz in front of shrubbery. ,"Nimitz, Chester W.; Nimitz, Catherine Freeman",United States - Virginia - Hampton Independent City - Hampton,Black and White Photograph,image/jpeg,Image;StillImage,2017.092.008b-162,eng,Nimitz Family Photograph Collection,https://digitalarchive.pacificwarmuseum.org/digital/collection/p16769coll20,Commercial use is prohibited without permission from the National Museum of the Pacific War.,https://creativecommons.org/licenses/
nimitz16,https://tyvictoria.github.io/Nimitz-Images/nimitz16.jpg,Chester W. Nimitz Giving a Speech,,1956-05-31,"Photograph of Chester W. Nimitz standing at a wooden podium with a standing microphone beside it, giving speech at the U.S. Naval Postgraduate School, Monterey, California.","United States. Navy; Nimitz, Chester W.; Speeches",United States - California - Monterey County - Monterey,Black and White Photograph,image/jpeg,Image;StillImage,2017.092.008b-263-265,eng,Nimitz Family Photograph Collection,https://digitalarchive.pacificwarmuseum.org/digital/collection/p16769coll21,Commercial use is prohibited without permission from the National Museum of the Pacific War.,https://creativecommons.org/licenses/
nimitz17,https://tyvictoria.github.io/Nimitz-Images/nimitz17.jpg,Chester W. Nimitz with Colonel Breckenridge,,1926-05-19,Photograph of Chester W. Nimitz standing with friend Colonel Breckenridge.,"Nimitz, Chester W.; Breckinridge, James C.",United States,Black and White Photograph,image/jpeg,Image;StillImage,2017.092.008b-157,eng,Nimitz Family Photograph Collection,https://digitalarchive.pacificwarmuseum.org/digital/collection/p16769coll22,Commercial use is prohibited without permission from the National Museum of the Pacific War.,https://creativecommons.org/licenses/
nimitz18,https://tyvictoria.github.io/Nimitz-Images/nimitz18.jpg,"Portrait of Fleet Admiral Chester W. Nimitz, #1",,1945-01-21,Portrait of Fleet Admiral Chester W. Nimitz from the chest up in front of a map.,"United States. Navy; Nimitz, Chester W.; Portraits; Maps; WW2",United States,Black and White Photograph,image/jpeg,Image;StillImage,2017.092.008d-a,eng,Nimitz Family Photograph Collection,https://digitalarchive.pacificwarmuseum.org/digital/collection/p16769coll23,Commercial use is prohibited without permission from the National Museum of the Pacific War.,https://creativecommons.org/licenses/
nimitz19,https://tyvictoria.github.io/Nimitz-Images/nimitz19.jpg,Fleet Admiral Chester W. Nimitz Points At a Map,Official U.S. Navy Photograph,1949-03-28,"Photograph of Fleet Admiral Chester W. Nimitz, United Nations Plebiscite Administrator for Jammu-Kashmir, pointing to a map in the office of Trygve Lie, U.N. Secretary General. ","United States. Navy; Nimitz, Chester W.; Lie, Trygve; Maps; Plebiscite Administrator; Pacific Fleet; Maps",United States - New York - Nassau County - North Hempstead,Black and White Photograph,image/jpeg,Image;StillImage,2005.661.258a-s,eng,Nimitz Family Photograph Collection,https://digitalarchive.pacificwarmuseum.org/digital/collection/p16769coll24,Commercial use is prohibited without permission from the National Museum of the Pacific War.,https://creativecommons.org/licenses/
nimitz20,https://tyvictoria.github.io/Nimitz-Images/nimitz20.jpg,Fleet Admiral Chester W. Nimitz Receives Award from Cardinal Spellman,Official U.S. Navy Photograph,1947-01-21,Photograph of Fleet Admiral Chester W. Nimitz receiving the 1946 Club of Champions Award of the Catholic Youth Organization of the Archdiocese of New York from Cardinal Francis Spellman. ,"United States. Navy; Nimitz, Chester W.; Francis, Spellman; Cardinals; Awards; Catholic Youth Organization",United States - New York - New York City,Black and White Photograph,image/jpeg,Image;StillImage,2005.661.258a-t,eng,Nimitz Family Photograph Collection,https://digitalarchive.pacificwarmuseum.org/digital/collection/p16769coll25,Commercial use is prohibited without permission from the National Museum of the Pacific War.,https://creativecommons.org/licenses/
nimitz21,https://tyvictoria.github.io/Nimitz-Images/nimitz21.jpg,Admiral Chester W. Nimitz Watches Enlisted Sailor Pitch Horseshoes,,1944-05-21,"Photograph of Admiral Chester W. Nimitz watching an enlisted sailor, possibly Anthony Trifiletti, pitch horseshoes during picnic on the beach.","United States. Navy; Nimitz, Chester W.; Trifiletti, Anthony; Horseshoes; Beaches; WW2",United States - Hawaii - Honolulu County - Oahu Island,Black and White Photograph,image/jpeg,Image;StillImage,2005.661.258a-c,eng,Nimitz Family Photograph Collection,https://digitalarchive.pacificwarmuseum.org/digital/collection/p16769coll26,Commercial use is prohibited without permission from the National Museum of the Pacific War.,https://creativecommons.org/licenses/
nimitz22,https://tyvictoria.github.io/Nimitz-Images/nimitz22.jpg,Officers and Enlisted Men Aboard U.S.S. Arizona During Command Change,Official U.S. Navy Photograph,1939-05-26,Photograph of officers and enlisted men lining the deck of the U.S.S. Arizona during a change of command ceremony.,"United States. Navy; Nimitz, Chester W.; U.S.S. Arizona; Change of Command; Ceremonies; WW2; Ships",United States - California - Los Angeles County - San Pedro,Black and White Photograph,image/jpeg,Image;StillImage,2005.661.258a-cc,eng,Nimitz Family Photograph Collection,https://digitalarchive.pacificwarmuseum.org/digital/collection/p16769coll27,Commercial use is prohibited without permission from the National Museum of the Pacific War.,https://creativecommons.org/licenses/
nimitz23,https://tyvictoria.github.io/Nimitz-Images/nimitz23.jpg,Chester W. Nimitz Relieving J. O. Richardson as Chief of the Bureau of Navigation,Official U.S. Navy Photograph,1939-06-15,"Photograph of an unidentified man, Rear Admiral Chester W. Nimitz, and Admiral J. O. Richardson standing together during change of command where Nimitz relieves Richardson as Chief of Bureau of Navigation.","United States. Navy; Nimitz, Chester W.; Richardson, James O.; Bureau of Navigation; Ceremonies; WW2",United States,Black and White Photograph,image/jpeg,Image;StillImage,2005.661.258a-ee,eng,Nimitz Family Photograph Collection,https://digitalarchive.pacificwarmuseum.org/digital/collection/p16769coll28,Commercial use is prohibited without permission from the National Museum of the Pacific War.,https://creativecommons.org/licenses/
nimitz24,https://tyvictoria.github.io/Nimitz-Images/nimitz24.jpg,Admiral Chester W. Nimitz During Change of Command Ceremony,Official U.S. Navy Photograph,1941-12-31,Photograph of Admiral Chester W. Nimitz standing in front of seven men in uniform during change of command ceremony.,"United States. Navy; Nimitz, Chester W.; Kimmel, Husband E.; Change of Command; Ceremonies; WW2",United States,Black and White Photograph,image/jpeg,Image;StillImage,2005.661.258a-ff,eng,Nimitz Family Photograph Collection,https://digitalarchive.pacificwarmuseum.org/digital/collection/p16769coll29,Commercial use is prohibited without permission from the National Museum of the Pacific War.,https://creativecommons.org/licenses/
nimitz25,https://tyvictoria.github.io/Nimitz-Images/nimitz25.jpg,Admiral Chester W. Nimitz and Admiral Halsey Aboard U.S.S. Curtiss,Official U.S. Navy Photograph,1943-01-20,Photograph of Admiral Chester W. Nimitz and Admiral Halsey talking aboard the U.S.S. Curtiss. ,"United States. Navy; Nimitz, Chester W.; Halsey, William F., Jr.; U.S.S. Curtiss; Naval Bases; WW2; Ships",Vanuatu - Espiritu Santo Island,Black and White Photograph,image/jpeg,Image;StillImage,2005.661.258a-gg,eng,Nimitz Family Photograph Collection,https://digitalarchive.pacificwarmuseum.org/digital/collection/p16769coll30,Commercial use is prohibited without permission from the National Museum of the Pacific War.,https://creativecommons.org/licenses/
nimitz26,https://tyvictoria.github.io/Nimitz-Images/nimitz26.jpg,Japanese Surrender Ceremony on Board the U.S.S. Missouri,Official U.S. Navy Photograph,1945-09-02,Color photograph of Japanese surrender ceremony on board the U.S.S. Missouri.,"United States. Navy; Nimitz, Chester W.; Umezu, Yoshijirō; U.S.S. Missouri; Tokyo Bay; Surrender; WW2; Ships",Japan - Kanto Region - Tokyo Bay,Color Photograph,image/jpeg,Image;StillImage,2005.661.258a-hh,eng,Nimitz Family Photograph Collection,https://digitalarchive.pacificwarmuseum.org/digital/collection/p16769coll31,Commercial use is prohibited without permission from the National Museum of the Pacific War.,https://creativecommons.org/licenses/
nimitz27,https://tyvictoria.github.io/Nimitz-Images/nimitz27.jpg,Fleet Admiral Chester W. Nimitz During Change of Command Ceremony,Official U.S. Navy Photograph,1945-11-24,"Photograph of Fleet Admiral Chester W. Nimitz standing at a wooden podium and microphone during change of command ceremony on board U.S.S. Menhaden, Pearl Harbor. ","United States. Navy; Nimitz, Chester W.; Spruance, Raymond A.; U.S.S. Menhaden; Pearl Harbor; Change of Command; Ships",United States - Hawaii - Honolulu County - Oahu Island,Black and White Photograph,image/jpeg,Image;StillImage,2005.661.258a-o,eng,Nimitz Family Photograph Collection,https://digitalarchive.pacificwarmuseum.org/digital/collection/p16769coll32,Commercial use is prohibited without permission from the National Museum of the Pacific War.,https://creativecommons.org/licenses/
nimitz28,https://tyvictoria.github.io/Nimitz-Images/nimitz28.jpg,Fleet Admiral Chester W. Nimitz Sits at Desk in Headquarters,Official U.S. Navy Photograph,1945-04-16,Photograph of Fleet Admiral Chester W. Nimitz sitting at his desk holding a large document open in his hands.,"United States. Navy; Nimitz, Chester W.; WW2",Guam,Black and White Photograph,image/jpeg,Image;StillImage,2005.661.258a-n,eng,Nimitz Family Photograph Collection,https://digitalarchive.pacificwarmuseum.org/digital/collection/p16769coll33,Commercial use is prohibited without permission from the National Museum of the Pacific War.,https://creativecommons.org/licenses/
nimitz29,https://tyvictoria.github.io/Nimitz-Images/nimitz29.jpg,Fleet Admiral Chester W. Nimitz Reads a Document Aboard Plane,Official U.S. Navy Photograph,1945-04-26,Photograph of Fleet Admiral Chester W. Nimitz leaning back as he reads a document aboard his plane.,"United States. Navy; Nimitz, Chester W.; Airplanes; WW2",United States,Black and White Photograph,image/jpeg,Image;StillImage,2005.661.258a-o,eng,Nimitz Family Photograph Collection,https://digitalarchive.pacificwarmuseum.org/digital/collection/p16769coll34,Commercial use is prohibited without permission from the National Museum of the Pacific War.,https://creativecommons.org/licenses/
nimitz30,https://tyvictoria.github.io/Nimitz-Images/nimitz30.jpg,Fleet Admiral Chester W. Nimitz Sits at His Desk,Official U.S. Navy Photograph,1950-04-26,Photograph of Fleet Admiral Chester W. Nimitz sitting at his desk that is covered with various papers and books.,"United States. Navy; Nimitz, Chester W.",United States,Black and White Photograph,image/jpeg,Image;StillImage,2005.661.258a-p,eng,Nimitz Family Photograph Collection,https://digitalarchive.pacificwarmuseum.org/digital/collection/p16769coll35,Commercial use is prohibited without permission from the National Museum of the Pacific War.,https://creativecommons.org/licenses/
nimitz31,https://tyvictoria.github.io/Nimitz-Images/nimitz31.jpg,Admiral Sir Bruce Fraser Awards Fleet Admiral Chester W. Nimitz the Grand Cross of the Bath,Official U.S. Navy Photograph,1945-03-11,"Photograph of Admiral Sir Bruce Fraser, Royal Navy, awarding Fleet Admiral Chester W. Nimitz the Grand Cross of the Bath aboard the HMS Duke of York, Guam.","United States. Navy; Nimitz, Chester W.; England and Wales. Royal Navy; Fraser, Bruce; HMS Duke of York; Awards; Cross of the Bath; Ceremonies",Guam,Black and White Photograph,image/jpeg,Image;StillImage,2005.661.258a-q,eng,Nimitz Family Photograph Collection,https://digitalarchive.pacificwarmuseum.org/digital/collection/p16769coll36,Commercial use is prohibited without permission from the National Museum of the Pacific War.,https://creativecommons.org/licenses/
nimitz32,https://tyvictoria.github.io/Nimitz-Images/nimitz32.jpg,Fleet Admiral Chester W. Nimitz Receives a Statuette,Official U.S. Navy Photograph,1954-02-13,"Photograph of Fleet Admiral Chester W. Nimitz receiving a statuette for 'An Inspiring Example of Leadership to Youth' from Eagle Scout Robert Black aboard the U.S.S. Kearsarge, San Francisco Naval Shipyard, California.","United States. Navy; Nimitz, Chester W.; Eagle Scouts; Boy Scouts of America; U.S.S. Kearsarge; San Francisco Naval Shipyard; Black, Robert; Awards; Ceremonies",United States - California - San Francisco County - San Francisco,Black and White Photograph,image/jpeg,Image;StillImage,2005.661.258a-u,eng,Nimitz Family Photograph Collection,https://digitalarchive.pacificwarmuseum.org/digital/collection/p16769coll37,Commercial use is prohibited without permission from the National Museum of the Pacific War.,https://creativecommons.org/licenses/
nimitz33,https://tyvictoria.github.io/Nimitz-Images/nimitz33.jpg,Fleet Admiral Chester W. Nimitz and Captain Robert T. S. Keith Aboard the U.S.S. Missouri,Official U.S. Navy Photograph,1954-09-17,Photograph of Fleet Admiral Chester W. Nimitz standing with Captain Robert T. S. Keith aboard the U.S.S. Missouri.,"United States. Navy; Nimitz, Chester W.; Keith, Robert T. S.; U.S.S. Missouri; Ships",United States - California - San Francisco County - San Francisco,Black and White Photograph,image/jpeg,Image;StillImage,2005.661.258a-v,eng,Nimitz Family Photograph Collection,https://digitalarchive.pacificwarmuseum.org/digital/collection/p16769coll38,Commercial use is prohibited without permission from the National Museum of the Pacific War.,https://creativecommons.org/licenses/
nimitz34,https://tyvictoria.github.io/Nimitz-Images/nimitz34.jpg,"Admiral Chester W. Nimitz Inspects Tarawa, #2",,1943-11-01,Photograph of Admiral Chester W. Nimitz as he inspects Tarawa with a large group of men in uniform.,"United States. Navy; United States. Marine Corps; United States. Army; Nimitz, Chester W.; Smith, Julian Constable; Inspections; WW2",Kiribati - Gilbert Islands - Tarawa Atoll,Black and White Photograph,image/jpeg,Image;StillImage,2005.661.258a-w,eng,Nimitz Family Photograph Collection,https://digitalarchive.pacificwarmuseum.org/digital/collection/p16769coll39,Commercial use is prohibited without permission from the National Museum of the Pacific War.,https://creativecommons.org/licenses/
