objectid,filename,title,creator,date,description,subject,location,format original,format,type,identifier,language,collection,linktocollection,rights,rightsstatement
nimitz35,https://tyvictoria.github.io/Nimitz-Images/nimitz35.jpg,"Portrait of Fleet Admiral Chester W. Nimitz, #2",Official U.S. Navy Photograph,1945-01-21,Portrait of Fleet Admiral Chester W. Nimitz from the chest up in front of a map.,"United States. Navy; Nimitz, Chester W.; Portraits; Maps; WW2",United States,Black and White Photograph,image/jpeg,Image;StillImage,2005.661.258a-oo,eng,Nimitz Family Photograph Collection,https://digitalarchive.pacificwarmuseum.org/digital/collection/p16769coll40,Commercial use is prohibited without permission from the National Museum of the Pacific War.,https://creativecommons.org/licenses/
nimitz36,https://tyvictoria.github.io/Nimitz-Images/nimitz36.jpg,"Admiral Chester W. Nimitz Inspects Tarawa, #1",,     1943-011-01,Photograph of Admiral Chester W. Nimitz inspects Tarawa with a group of other men,"United States. Navy; United States. Marine Corps; United States. Army; Nimitz, Chester W.; Smith, Julian Constable; Price, Charles Fredrick Berthold; Richardson, Robert C., Jr.; Inspections; WW2",Kiribati - Gilbert Islands - Tarawa Atoll,Black and White Photograph,image/jpeg,Image;StillImage,2005.661.258a-x,eng,Nimitz Family Photograph Collection,https://digitalarchive.pacificwarmuseum.org/digital/collection/p16769coll41,Commercial use is prohibited without permission from the National Museum of the Pacific War.,https://creativecommons.org/licenses/
nimitz37,https://tyvictoria.github.io/Nimitz-Images/nimitz37.jpg,Fleet Admiral Chester W. Nimitz Attends a Reception,Official U.S. Army Photograph,1949-03-11,"Photograph of Fleet Admiral Chester W. Nimitz attends a reception in honor of J. B. Pinheiro, Acting Consul General of Brazil Officers Club, Presidio of San Francisco, California. ","United States. Army; United States. Navy; Nimitz, Chester W.; Celebrations; Receptions; Pinheiro, J. B.",United States - California - San Francisco County - San Francisco,Black and White Photograph,image/jpeg,Image;StillImage,2005.661.258a-y,eng,Nimitz Family Photograph Collection,https://digitalarchive.pacificwarmuseum.org/digital/collection/p16769coll42,Commercial use is prohibited without permission from the National Museum of the Pacific War.,https://creativecommons.org/licenses/
nimitz38,https://tyvictoria.github.io/Nimitz-Images/nimitz38.jpg,"J. W. Leverton, James T. Lay, Catherine Nimitz, and Nancy Nimitz at the Nimitz-Lay Wedding",,1945-03-09,"Photograph of J. W. Leverton, James T. Lay, Catherine Nimitz, and Nancy Nimitz in a line at the Nimitz-Lay wedding.","Lay, James T.; Nimitz, Catherine; Leverton, J. W.; Nimitz, Nancy; Weddings; Celebrations",United States,Black and White Photograph,image/jpeg,Image;StillImage,2017.092.008d-dd,eng,Nimitz Family Photograph Collection,https://digitalarchive.pacificwarmuseum.org/digital/collection/p16769coll43,Commercial use is prohibited without permission from the National Museum of the Pacific War.,https://creativecommons.org/licenses/
nimitz39,https://tyvictoria.github.io/Nimitz-Images/nimitz39.jpg,"James T. Lay, Catherine Nimitz, and Chester W. Nimitz at Nimitz-Lay Wedding",,1945-03-09,"Photograph of James T. Lay, Catherine Nimitz, and Fleet Admiral Chester W. Nimitz at Nimitz-Lay wedding.","Lay, James T.; Nimitz, Catherine; Nimitz, Chester W.; Weddings; Celebrations",United States,Black and White Photograph,image/jpeg,Image;StillImage,2017.092.008d-ee,eng,Nimitz Family Photograph Collection,https://digitalarchive.pacificwarmuseum.org/digital/collection/p16769coll44,Commercial use is prohibited without permission from the National Museum of the Pacific War.,https://creativecommons.org/licenses/
nimitz40,https://tyvictoria.github.io/Nimitz-Images/nimitz40.jpg,"Douglas MacArthur, Franklin D. Roosevelt, Chester W. Nimitz, and William Leahy Aboard the U.S.S. Baltimore",Official U.S. Navy Photograph,1944-07-26,"Photograph of General Douglas MacArthur, President Franklin D. Roosevelt, Admiral Chester W. Nimitz, and Admiral William Leahy sitting side by side aboard the U.S.S. Baltimore, Honolulu, Hawaii.","United States. Navy; United States. Air Force; United States. Army; Roosevelt, Franklin D.; Macarthur, Douglas; Halsey, William F., Jr.; Nimitz, Chester W.; U.S.S. Baltimore; Presidents; Pacific Fleet; WW2; Ships",United States - Hawaii - Honolulu County - Honolulu,Black and White Photograph,image/jpeg,Image;StillImage,2005.661.258a-k,eng,Nimitz Family Photograph Collection,https://digitalarchive.pacificwarmuseum.org/digital/collection/p16769coll45,Commercial use is prohibited without permission from the National Museum of the Pacific War.,https://creativecommons.org/licenses/
nimitz41,https://tyvictoria.github.io/Nimitz-Images/nimitz41.jpg,"Chester W. Nimitz in Texas Regalia, #2",,1947,Photograph of Chester W. Nimitz standing behind a table and microphone dressed in Texas regalia.,"United States. Navy; Nimitz, Chester W.; American Flags; Texas",United States - Washington D.C.,Black and White Photograph,image/jpeg,Image;StillImage,2005.661.258a-i,eng,Nimitz Family Photograph Collection,https://digitalarchive.pacificwarmuseum.org/digital/collection/p16769coll46,Commercial use is prohibited without permission from the National Museum of the Pacific War.,https://creativecommons.org/licenses/
nimitz42,https://tyvictoria.github.io/Nimitz-Images/nimitz42.jpg,Nimitz Family Car,,1929,"Photograph of the Nimitz family car, the Flying Cloud by Reo Motor Car Company on a dusty road. ",Automobiles; Flying Cloud; Reo Car Motor Company;,United States - California - San Diego County - San Diego,Black and White Photograph,image/jpeg,Image;StillImage,2005.661.259h,eng,Nimitz Family Photograph Collection,https://digitalarchive.pacificwarmuseum.org/digital/collection/p16769coll47,Commercial use is prohibited without permission from the National Museum of the Pacific War.,https://creativecommons.org/licenses/
nimitz43,https://tyvictoria.github.io/Nimitz-Images/nimitz43.jpg,"Chester W. Nimitz and Catherine Freeman Nimitz, #1",,1913,Photograph of Chester W. Nimitz and Catherine Freeman Nimitz shortly after being married.,"Nimitz, Chester W.; Nimitz, Catherine Freeman; Weddings",United States,Black and White Photograph,image/jpeg,Image;StillImage,2005.661.259m,eng,Nimitz Family Photograph Collection,https://digitalarchive.pacificwarmuseum.org/digital/collection/p16769coll48,Commercial use is prohibited without permission from the National Museum of the Pacific War.,https://creativecommons.org/licenses/
nimitz44,https://tyvictoria.github.io/Nimitz-Images/nimitz44.jpg,"Chester W. Nimitz and Catherine Nimitz at Fiesta, San Antonio, #2",,1948-04,Photograph of Fleet Admiral Chester W. Nimitz and Catherine Freeman Nimitz at a Fiesta in San Antonio.,"Nimitz, Chester W.; Nimitz Catherine Freeman; Fiestas; Celebrations",United States - Texas - Bexar County - San Antonio,Black and White Photograph,image/jpeg,Image;StillImage,2005.661.259u,eng,Nimitz Family Photograph Collection,https://digitalarchive.pacificwarmuseum.org/digital/collection/p16769coll49,Commercial use is prohibited without permission from the National Museum of the Pacific War.,https://creativecommons.org/licenses/
nimitz45,https://tyvictoria.github.io/Nimitz-Images/nimitz45.jpg,Catherine Freeman Nimitz Sits with Dog,,1912,"Photograph of Catherine Freeman Nimitz sitting on steps with a dog, possibly Dixie.","Nimitz, Catherine Freeman; Dogs; Dixie; ",United States,Black and White Photograph,image/jpeg,Image;StillImage,2017.092.008b-129,eng,Nimitz Family Photograph Collection,https://digitalarchive.pacificwarmuseum.org/digital/collection/p16769coll50,Commercial use is prohibited without permission from the National Museum of the Pacific War.,https://creativecommons.org/licenses/
nimitz46,https://tyvictoria.github.io/Nimitz-Images/nimitz46.jpg,Kate Nimitz Holds Mary Nimitz on Board the U.S.S. Rigel,,1931,"Photograph of Catherine Nimitz (Kate) sitting and holding her sister, Mary Nimitz (Sister Aquinas), on board the U.S.S. Rigel. ","Nimitz, Catherine; Nimitz, Kate; Nimitz, Mary; Sister Aquinas; Babies; Children; U.S.S. Rigel",United States,Black and White Photograph,image/jpeg,Image;StillImage,2017.092.008b-134,eng,Nimitz Family Photograph Collection,https://digitalarchive.pacificwarmuseum.org/digital/collection/p16769coll51,Commercial use is prohibited without permission from the National Museum of the Pacific War.,https://creativecommons.org/licenses/
nimitz47,https://tyvictoria.github.io/Nimitz-Images/nimitz47.jpg,Admiral Chester W. Nimitz Salutes on Board HMS Duke of York,,1945-09,Photograph of Admiral Chester W. Nimitz saluting on board the HMS Duke of York.,"United States. Navy; Nimitz, Chester W.; HMS Duke of York; WW2; Ships",Guam,Black and White Photograph,image/jpeg,Image;StillImage,2017.092.008d-cc,eng,Nimitz Family Photograph Collection,https://digitalarchive.pacificwarmuseum.org/digital/collection/p16769coll52,Commercial use is prohibited without permission from the National Museum of the Pacific War.,https://creativecommons.org/licenses/
nimitz48,https://tyvictoria.github.io/Nimitz-Images/nimitz48.jpg,Chester W. Nimitz Walks Out of Bunker on Midway Island,,1942-06,Photograph of Admiral Chester W. Nimitz emerging from an underground bunker on Midway Island.,"United States. Navy; Nimitz, Chester W.; Bunkers",United States - Hawaii - Midway Island,Black and White Photograph,image/jpeg,Image;StillImage,2017.092.008d-i,eng,Nimitz Family Photograph Collection,https://digitalarchive.pacificwarmuseum.org/digital/collection/p16769coll53,Commercial use is prohibited without permission from the National Museum of the Pacific War.,https://creativecommons.org/licenses/
nimitz49,https://tyvictoria.github.io/Nimitz-Images/nimitz49.jpg,"Chester W. Nimitz and Catherine Nimitz at Fiesta, San Antonio, #1",,1948-04,Photograph of Fleet Admiral Chester W. Nimitz and Catherine Freeman Nimitz at a Fiesta in San Antonio.,"Nimitz, Chester W.; Nimitz Catherine Freeman; Fiestas; Celebrations",United States - Texas - Bexar County - San Antonio,Black and White Photograph,image/jpeg,Image;StillImage,2017.092.008d-ii,eng,Nimitz Family Photograph Collection,https://digitalarchive.pacificwarmuseum.org/digital/collection/p16769coll54,Commercial use is prohibited without permission from the National Museum of the Pacific War.,https://creativecommons.org/licenses/
nimitz50,https://tyvictoria.github.io/Nimitz-Images/nimitz50.jpg,Nimitz Children on Board the U.S.S. Rigel,,1931,"Photograph of the Nimitz children, Anna Nimitz (Nancy), Chester W. Nimitz Jr. (Chet), Catherine Nimitz (Kate), and Mary Nimitz, on board the U.S.S. Rigel. ","Nimitz, Chester Jr.; Nimitz, Chet; Nimitz, Mary; Nimitz, Anna; Nimitz, Nancy; Nimiz, Catherine; Nimitz, Kate; U.S.S. Rigel; Children; Babies; Ships",United States,Black and White Photograph,image/jpeg,Image;StillImage,2017.092.008d-m,eng,Nimitz Family Photograph Collection,https://digitalarchive.pacificwarmuseum.org/digital/collection/p16769coll55,Commercial use is prohibited without permission from the National Museum of the Pacific War.,https://creativecommons.org/licenses/
nimitz51,https://tyvictoria.github.io/Nimitz-Images/nimitz51.jpg,Admiral Chester W. Nimitz Wearing Hawaiian Lei,,1945,Photograph of Admiral Chester W. Nimitz in his white Naval uniform and a Hawaiian lei.,"United States. Navy; Nimitz, Chester W.; Leis",United States,Black and White Photograph,image/jpeg,Image;StillImage,2017.092.008d-pp,eng,Nimitz Family Photograph Collection,https://digitalarchive.pacificwarmuseum.org/digital/collection/p16769coll56,Commercial use is prohibited without permission from the National Museum of the Pacific War.,https://creativecommons.org/licenses/
nimitz52,https://tyvictoria.github.io/Nimitz-Images/nimitz52.jpg,"Chester W. Nimitz, Forrest P. Sherman, and Charles H. Mcmorris Stand Near Binoculars",,1945,"Photograph of Fleet Admiral Chester W. Nimitz, Forrest P. Sherman, and Charles H. McMorris standing behind binoculars mounted on a tripod.","United States. Navy; Nimitz, Chester W.; Sherman, Forrest P.;Mcmorris, Charles H.; WW2",Guam,Black and White Photograph,image/jpeg,Image;StillImage,2017.092.008d-q,eng,Nimitz Family Photograph Collection,https://digitalarchive.pacificwarmuseum.org/digital/collection/p16769coll57,Commercial use is prohibited without permission from the National Museum of the Pacific War.,https://creativecommons.org/licenses/
nimitz53,https://tyvictoria.github.io/Nimitz-Images/nimitz53.jpg,Portrait of Catherine Freeman as Young Girl,,1900,Portrait of a young Catherine Freeman.,"Nimitz, Catherine Freeman; Children",United States,Black and White Photograph,image/jpeg,Image;StillImage,2017.092.008d-r,eng,Nimitz Family Photograph Collection,https://digitalarchive.pacificwarmuseum.org/digital/collection/p16769coll58,Commercial use is prohibited without permission from the National Museum of the Pacific War.,https://creativecommons.org/licenses/
nimitz54,https://tyvictoria.github.io/Nimitz-Images/nimitz54.jpg,Chester W. Nimitz and Sergio Osmena,Official U.S. Navy Photograph,1945,"Photograph of Admiral Chester W. Nimitz with President of the Philippines Sergio Osmena, in Guam.","United States. Navy; Nimitz, Chester W.; Osmena, Sergio; Presdients; Philippines; WW2",Guam,Black and White Photograph,image/jpeg,Image;StillImage,2017.092.008d-u,eng,Nimitz Family Photograph Collection,https://digitalarchive.pacificwarmuseum.org/digital/collection/p16769coll59,Commercial use is prohibited without permission from the National Museum of the Pacific War.,https://creativecommons.org/licenses/
nimitz55,https://tyvictoria.github.io/Nimitz-Images/nimitz55.jpg,Admiral Chester W. Nimitz Sits with CINCPAC Staff on Porch,,1944,Photograph of Admiral Chester W. Nimitz sitting with CINCPAC staff on porch in Guam.,"United States. Navy; Nimitz, Chester W.; CINCPAC; Pacific Fleet; WW2",Guam,Black and White Photograph,image/jpeg,Image;StillImage,2017.092.008d-v,eng,Nimitz Family Photograph Collection,https://digitalarchive.pacificwarmuseum.org/digital/collection/p16769coll60,Commercial use is prohibited without permission from the National Museum of the Pacific War.,https://creativecommons.org/licenses/
nimitz56,https://tyvictoria.github.io/Nimitz-Images/nimitz56.jpg,"Group Portrait of Catherine Nimitz, Anna Nimitz, and Chester W. Nimitz",,1929,"Group portrait of Catherine Nimitz, Anna Nimitz (Nancy), and Chester W. Nimitz.","Nimitz, Catherine Freeman; Nimitz, Chester W.; Nimitz, Anna; Nimitz, Nancy",United States,Black and White Photograph,image/jpeg,Image;StillImage,2017.092.008d-w,eng,Nimitz Family Photograph Collection,https://digitalarchive.pacificwarmuseum.org/digital/collection/p16769coll61,Commercial use is prohibited without permission from the National Museum of the Pacific War.,https://creativecommons.org/licenses/
nimitz57,https://tyvictoria.github.io/Nimitz-Images/nimitz57.jpg,"Naval Academy Classmates Chester W. Nimitz, George Stewart, and Royal E. Ingersoll, #2",,1902,"Photograph of Chester W. Nimitz, George Stewart, and Royal E. Ingersoll on deck of U.S.S. Massachusetts in white sailor uniforms. Above Chester W. Nimitz is his signature.","United States. Navy; Nimitz, Chester W.; Stewart, George; Ingersoll, Royal E.; U.S.S. Massachusetts; Ships",United States,Black and White Photograph,image/jpeg,Image;StillImage,2017.092.008d-y,eng,Nimitz Family Photograph Collection,https://digitalarchive.pacificwarmuseum.org/digital/collection/p16769coll62,Commercial use is prohibited without permission from the National Museum of the Pacific War.,https://creativecommons.org/licenses/
nimitz58,https://tyvictoria.github.io/Nimitz-Images/nimitz58.jpg,"Portrait of Chester W. Nimitz in Midshipman Uniform, #2",,1902-10,"Portrait of Chester W. Nimitz in Naval uniform. His signature appears below the photographic print. Handwritten in red ink beneath his signature is: ""Midshipman 4th class - Fall 1901"". ","United States. Navy; Nimitz, Chester W.; Midshipman;",United States - Connecticut - Fairfield County - New Canaan,Black and White Photograph,image/jpeg,Image;StillImage,2017.092.008d-z,eng,Nimitz Family Photograph Collection,https://digitalarchive.pacificwarmuseum.org/digital/collection/p16769coll63,Commercial use is prohibited without permission from the National Museum of the Pacific War.,https://creativecommons.org/licenses/
nimitz59,https://tyvictoria.github.io/Nimitz-Images/nimitz59.jpg,Fleet Admiral Chester W. Nimitz Speaking at Welcome Home Parade,,1945,Photograph of Fleet Admiral Chester W. Nimitz in Navy uniform giving a speech behind a decorated podium during a welcome parade.,"United States. Navy; Nimitz, Chester W.; Speeches; Parades",United States - New York - New York City,Black and White Photograph,image/jpeg,Image;StillImage,2017.092.008e-a,eng,Nimitz Family Photograph Collection,https://digitalarchive.pacificwarmuseum.org/digital/collection/p16769coll64,Commercial use is prohibited without permission from the National Museum of the Pacific War.,https://creativecommons.org/licenses/
nimitz60,https://tyvictoria.github.io/Nimitz-Images/nimitz60.jpg,"Naval Academy Classmates Chester W. Nimitz, George Stewart, and Royal E. Ingersoll",,1902,"Photograph of Chester W. Nimitz, George Stewart, and Royal E. Ingersoll on deck of USS Massachusetts in white sailor uniforms. Beside each of the men is their signature. ","United States. Navy; Nimitz, Chester W.; Stewart, George; Ingersoll, Royal E.; U.S.S. Massachusetts; Ships",United States,Black and White Photograph,image/jpeg,Image;StillImage,2017.092.008e-v,eng,Nimitz Family Photograph Collection,https://digitalarchive.pacificwarmuseum.org/digital/collection/p16769coll65,Commercial use is prohibited without permission from the National Museum of the Pacific War.,https://creativecommons.org/licenses/
nimitz61,https://tyvictoria.github.io/Nimitz-Images/nimitz61.jpg,Chester W. Nimitz and Dora Nimitz,,1913,Photograph of Dora Nimitz and Chester W. Nimitz standing side by side on a patch of grass in an unknown location.,"Nimitz, Chester W.; Nimitz, Dora",United States,Black and White Photograph,image/jpeg,Image;StillImage,2017.092.008b-173-175,eng,Nimitz Family Photograph Collection,https://digitalarchive.pacificwarmuseum.org/digital/collection/p16769coll66,Commercial use is prohibited without permission from the National Museum of the Pacific War.,https://creativecommons.org/licenses/
nimitz62,https://tyvictoria.github.io/Nimitz-Images/nimitz62.jpg,U.S.S. Nimitz,,1972,"Photograph of a ship that appears to be the U.S.S. Nimitz at dock adorned with red, white and blue decorations.",United States. Navy; U.S.S. Nimitz; Ships,United States,Black and White Photograph,image/jpeg,Image;StillImage,2017.092.008b-188-190,eng,Nimitz Family Photograph Collection,https://digitalarchive.pacificwarmuseum.org/digital/collection/p16769coll67,Commercial use is prohibited without permission from the National Museum of the Pacific War.,https://creativecommons.org/licenses/
nimitz63,https://tyvictoria.github.io/Nimitz-Images/nimitz63.jpg,Chester W. Nimitz Reads to Daughter Catherine,,1914,Photograph of Lieutenant Chester W. Nimitz reading a book to his daughter Catherine Nimitz (Kate).,"Nimitz, Chester W.; Nimitz, Catherine; Nimitz, Kate; Babies",United States,Black and White Photograph,image/jpeg,Image;StillImage,2017.092.008b-203-205,eng,Nimitz Family Photograph Collection,https://digitalarchive.pacificwarmuseum.org/digital/collection/p16769coll68,Commercial use is prohibited without permission from the National Museum of the Pacific War.,https://creativecommons.org/licenses/
nimitz64,https://tyvictoria.github.io/Nimitz-Images/nimitz64.jpg,Chester W. Nimitz Fishing,,1913-04,"Photograph of Chester W. Nimitz fishing on the bank of the Guadalupe River, probably somewhere in Texas.","Nimitz, Chester W.; Fishing; Guadalupe River",United States - Texas,Black and White Photograph,image/jpeg,Image;StillImage,2017.092.008b-221-223,eng,Nimitz Family Photograph Collection,https://digitalarchive.pacificwarmuseum.org/digital/collection/p16769coll69,Commercial use is prohibited without permission from the National Museum of the Pacific War.,https://creativecommons.org/licenses/
nimitz65,https://tyvictoria.github.io/Nimitz-Images/nimitz65.jpg,Chester W. Nimitz on Board the Kaiserin Auguste Victoria,,1919-04,Photograph of Chester W. Nimitz and Mr. Gesenfeld on board the ship Kaiserin Auguste Victoria.,"Nimitz, Chester W.; Kaiserin Auguste Victoria; Ships",United States,Black and White Photograph,image/jpeg,Image;StillImage,2017.092.008b-272-274,eng,Nimitz Family Photograph Collection,https://digitalarchive.pacificwarmuseum.org/digital/collection/p16769coll70,Commercial use is prohibited without permission from the National Museum of the Pacific War.,https://creativecommons.org/licenses/
nimitz66,https://tyvictoria.github.io/Nimitz-Images/nimitz66.jpg,Mast of the U.S.S. Augusta,,1933-10,"Photograph of the tripod mast of U.S.S. Augusta. Handwritten on front: ""U.S.S. Augusta - October 1933 - 'Full Moonlight.' Best wishes for a Merry Christmas and a Happy New Year to my Sweetheart - from C.W.N."".",U.S.S. Augusta; Ships; United States. Navy,United States,Black and White Photograph,image/jpeg,Image;StillImage,"2017.092.008c-p",eng,Nimitz Family Photograph Collection,https://digitalarchive.pacificwarmuseum.org/digital/collection/p16769coll71,Commercial use is prohibited without permission from the National Museum of the Pacific War.,https://creativecommons.org/licenses/
nimitz67,https://tyvictoria.github.io/Nimitz-Images/nimitz67.jpg,"Admiral Chester W. Nimitz Stands at Microphone, #2",Official U.S. Navy Photograph,1945,Photograph of Admiral Chester W. Nimitz standing at a microphone.,"United States. Navy; Nimitz, Chester W.; Speeches",United States,Black and White Photograph,image/jpeg,Image;StillImage,2005.661.258a-qq,eng,Nimitz Family Photograph Collection,https://digitalarchive.pacificwarmuseum.org/digital/collection/p16769coll72,Commercial use is prohibited without permission from the National Museum of the Pacific War.,https://creativecommons.org/licenses/
nimitz68,https://tyvictoria.github.io/Nimitz-Images/nimitz68.jpg,"Admiral Chester W. Nimitz Stands at Microphone, #1",Official U.S. Navy Photograph,1945,Photograph of Admiral Chester W. Nimitz standing at a microphone.,"United States. Navy; Nimitz, Chester W.; Speeches",United States,Black and White Photograph,image/jpeg,Image;StillImage,2017.092.008d-s,eng,Nimitz Family Photograph Collection,https://digitalarchive.pacificwarmuseum.org/digital/collection/p16769coll73,Commercial use is prohibited without permission from the National Museum of the Pacific War.,https://creativecommons.org/licenses/
nimitz69,https://tyvictoria.github.io/Nimitz-Images/nimitz69.jpg,Color Portrait of Fleet Admiral Chester W. Nimitz,,1965,"Color portrait of Fleet Admiral Chester W. Nimitz giving a speech at Treasure Island, probably California.","United States. Navy; Nimitz, Chester W.; Speeches; Portraits",United States - California - San Francisco County - Treasure Island,Color Photograph,image/jpeg,Image;StillImage,2005.661.258a-m,eng,Nimitz Family Photograph Collection,https://digitalarchive.pacificwarmuseum.org/digital/collection/p16769coll74,Commercial use is prohibited without permission from the National Museum of the Pacific War.,https://creativecommons.org/licenses/
nimitz70,https://tyvictoria.github.io/Nimitz-Images/nimitz70.jpg,Admiral Chester W. Nimitz Stands with Arms Crossed,Official U.S. Navy Photograph,1942,"Photograph of Admiral Chester W. Nimitz standing with his arms crossed, only shown from the chest up.","United States. Navy; Nimitz, Chester W.; WW2",United States,Black and White Photograph,image/jpeg,Image;StillImage,2005.661.258a-mm,eng,Nimitz Family Photograph Collection,https://digitalarchive.pacificwarmuseum.org/digital/collection/p16769coll75,Commercial use is prohibited without permission from the National Museum of the Pacific War.,https://creativecommons.org/licenses/
nimitz71,https://tyvictoria.github.io/Nimitz-Images/nimitz71.jpg,Chester W. Nimitz and Daughters,,1965,"Color photograph of Chester W. Nimitz seated with dog, Gigi, daughter Nancy Nimitz, two unidentified women, and daughter Mary Nimitz (Sister Aquinas). ","Nimitz, Chester W.; Dogs; Gigi; Nimitz, Mary; Sister Aquinas; Nimitz, Anna; Nimitz, Nancy;",United States,Color Photograph,image/jpeg,Image;StillImage,2017.092.008b-197-199,eng,Nimitz Family Photograph Collection,https://digitalarchive.pacificwarmuseum.org/digital/collection/p16769coll76,Commercial use is prohibited without permission from the National Museum of the Pacific War.,https://creativecommons.org/licenses/
nimitz72,https://tyvictoria.github.io/Nimitz-Images/nimitz72.jpg,Fleet Admiral Chester W. Nimitz with Grace Adams,,1945-12,Photograph of Fleet Admiral Chester W. Nimitz sitting on a couch with Grace Adams. ,"United States. Navy; Nimitz, Chester W.; Adams, Grace; Adams, Ray;",United States,Black and White Photograph,image/jpeg,Image;StillImage,2005.661.258a-bb,eng,Nimitz Family Photograph Collection,https://digitalarchive.pacificwarmuseum.org/digital/collection/p16769coll77,Commercial use is prohibited without permission from the National Museum of the Pacific War.,https://creativecommons.org/licenses/
